{
  "schemaVersion": 1,
  "packId": "verbs-starter",
  "packVersion": 1,
  "title": "Fluency + Technical — Starter verbs",
  "entries": [
    {
      "id": "verb-freuen-auf",
      "kind": "verb",
      "lemma": "sich freuen",
      "construction": "sich freuen auf",
      "meaningEn": "to look forward to",
      "preposition": "auf",
      "governedCase": "accusative",
      "reflexiveCase": "accusative",
      "cefr": null,
      "tags": [
        "everyday",
        "technical"
      ],
      "examples": [
        {
          "id": "verb-freuen-auf-everyday",
          "domain": "everyday",
          "de": "Ich freue mich auf den Urlaub nächste Woche.",
          "en": "I am looking forward to the holiday next week."
        },
        {
          "id": "verb-freuen-auf-technical",
          "domain": "technical",
          "de": "Wir freuen uns auf die Ergebnisse der neuen Testreihe.",
          "en": "We are looking forward to the results of the new test series."
        }
      ],
      "editorialStatus": "prototype-reviewed"
    },
    {
      "id": "verb-freuen-ueber",
      "kind": "verb",
      "lemma": "sich freuen",
      "construction": "sich freuen über",
      "meaningEn": "to be happy about",
      "preposition": "über",
      "governedCase": "accusative",
      "reflexiveCase": "accusative",
      "cefr": null,
      "tags": [
        "everyday",
        "technical"
      ],
      "examples": [
        {
          "id": "verb-freuen-ueber-everyday",
          "domain": "everyday",
          "de": "Er freut sich über das Geschenk.",
          "en": "He is happy about the gift."
        },
        {
          "id": "verb-freuen-ueber-technical",
          "domain": "technical",
          "de": "Das Team freut sich über die erfolgreiche Validierung.",
          "en": "The team is happy about the successful validation."
        }
      ],
      "editorialStatus": "prototype-reviewed"
    },
    {
      "id": "verb-bestehen-aus",
      "kind": "verb",
      "lemma": "bestehen",
      "construction": "bestehen aus",
      "meaningEn": "to consist of",
      "preposition": "aus",
      "governedCase": "dative",
      "reflexiveCase": null,
      "cefr": null,
      "tags": [
        "everyday",
        "technical"
      ],
      "examples": [
        {
          "id": "verb-bestehen-aus-everyday",
          "domain": "everyday",
          "de": "Das Menü besteht aus einer Vorspeise und einem Hauptgang.",
          "en": "The menu consists of a starter and a main course."
        },
        {
          "id": "verb-bestehen-aus-technical",
          "domain": "technical",
          "de": "Die Konstruktion besteht aus hochfestem Stahl.",
          "en": "The structure consists of high-strength steel."
        }
      ],
      "editorialStatus": "prototype-reviewed"
    },
    {
      "id": "verb-warten-auf",
      "kind": "verb",
      "lemma": "warten",
      "construction": "warten auf",
      "meaningEn": "to wait for",
      "preposition": "auf",
      "governedCase": "accusative",
      "reflexiveCase": null,
      "cefr": null,
      "tags": [
        "everyday",
        "technical"
      ],
      "examples": [
        {
          "id": "verb-warten-auf-everyday",
          "domain": "everyday",
          "de": "Ich warte auf den Bus.",
          "en": "I am waiting for the bus."
        },
        {
          "id": "verb-warten-auf-technical",
          "domain": "technical",
          "de": "Das Team wartet auf die Freigabe der CAD-Zeichnung.",
          "en": "The team is waiting for the release of the CAD drawing."
        }
      ],
      "editorialStatus": "prototype-reviewed"
    },
    {
      "id": "verb-erinnern-an",
      "kind": "verb",
      "lemma": "sich erinnern",
      "construction": "sich erinnern an",
      "meaningEn": "to remember",
      "preposition": "an",
      "governedCase": "accusative",
      "reflexiveCase": "accusative",
      "cefr": null,
      "tags": [
        "everyday",
        "technical"
      ],
      "examples": [
        {
          "id": "verb-erinnern-an-everyday",
          "domain": "everyday",
          "de": "Erinnerst du dich an unseren ersten Ausflug?",
          "en": "Do you remember our first trip?"
        },
        {
          "id": "verb-erinnern-an-technical",
          "domain": "technical",
          "de": "Ich erinnere mich an die Parameter des alten Tests.",
          "en": "I remember the parameters of the old test."
        }
      ],
      "editorialStatus": "prototype-reviewed"
    },
    {
      "id": "verb-interessieren-fuer",
      "kind": "verb",
      "lemma": "sich interessieren",
      "construction": "sich interessieren für",
      "meaningEn": "to be interested in",
      "preposition": "für",
      "governedCase": "accusative",
      "reflexiveCase": "accusative",
      "cefr": null,
      "tags": [
        "everyday",
        "technical"
      ],
      "examples": [
        {
          "id": "verb-interessieren-fuer-everyday",
          "domain": "everyday",
          "de": "Mein Bruder interessiert sich für moderne Architektur.",
          "en": "My brother is interested in modern architecture."
        },
        {
          "id": "verb-interessieren-fuer-technical",
          "domain": "technical",
          "de": "Die Kunden interessieren sich für nachhaltige Werkstoffe.",
          "en": "The customers are interested in sustainable materials."
        }
      ],
      "editorialStatus": "prototype-reviewed"
    },
    {
      "id": "verb-antworten-auf",
      "kind": "verb",
      "lemma": "antworten",
      "construction": "antworten auf",
      "meaningEn": "to reply to",
      "preposition": "auf",
      "governedCase": "accusative",
      "reflexiveCase": null,
      "cefr": null,
      "tags": [
        "everyday",
        "technical"
      ],
      "examples": [
        {
          "id": "verb-antworten-auf-everyday",
          "domain": "everyday",
          "de": "Ich werde auf deine E-Mail antworten.",
          "en": "I will reply to your email."
        },
        {
          "id": "verb-antworten-auf-technical",
          "domain": "technical",
          "de": "Der Lieferant hat auf unsere Anfrage geantwortet.",
          "en": "The supplier has replied to our inquiry."
        }
      ],
      "editorialStatus": "prototype-reviewed"
    },
    {
      "id": "verb-glauben-an",
      "kind": "verb",
      "lemma": "glauben",
      "construction": "glauben an",
      "meaningEn": "to believe in",
      "preposition": "an",
      "governedCase": "accusative",
      "reflexiveCase": null,
      "cefr": null,
      "tags": [
        "everyday",
        "technical"
      ],
      "examples": [
        {
          "id": "verb-glauben-an-everyday",
          "domain": "everyday",
          "de": "Du musst an dich selbst glauben.",
          "en": "You must believe in yourself."
        },
        {
          "id": "verb-glauben-an-technical",
          "domain": "technical",
          "de": "Der Projektleiter glaubt an den Erfolg des neuen Konzepts.",
          "en": "The project manager believes in the success of the new concept."
        }
      ],
      "editorialStatus": "prototype-reviewed"
    },
    {
      "id": "verb-hoffen-auf",
      "kind": "verb",
      "lemma": "hoffen",
      "construction": "hoffen auf",
      "meaningEn": "to hope for",
      "preposition": "auf",
      "governedCase": "accusative",
      "reflexiveCase": null,
      "cefr": null,
      "tags": [
        "everyday",
        "technical"
      ],
      "examples": [
        {
          "id": "verb-hoffen-auf-everyday",
          "domain": "everyday",
          "de": "Wir hoffen auf schöneres Wetter.",
          "en": "We are hoping for better weather."
        },
        {
          "id": "verb-hoffen-auf-technical",
          "domain": "technical",
          "de": "Das Team hofft auf eine schnelle Genehmigung.",
          "en": "The team is hoping for quick approval."
        }
      ],
      "editorialStatus": "prototype-reviewed"
    },
    {
      "id": "verb-diskutieren-ueber",
      "kind": "verb",
      "lemma": "diskutieren",
      "construction": "diskutieren über",
      "meaningEn": "to discuss",
      "preposition": "über",
      "governedCase": "accusative",
      "reflexiveCase": null,
      "cefr": null,
      "tags": [
        "everyday",
        "technical"
      ],
      "examples": [
        {
          "id": "verb-diskutieren-ueber-everyday",
          "domain": "everyday",
          "de": "Wir diskutieren über dieses Thema.",
          "en": "We are discussing this topic."
        },
        {
          "id": "verb-diskutieren-ueber-technical",
          "domain": "technical",
          "de": "Die Ingenieure diskutieren über die Ergebnisse der Simulation.",
          "en": "The engineers are discussing the simulation results."
        }
      ],
      "editorialStatus": "prototype-reviewed"
    }
  ],
  "questions": [
    {
      "id": "verb-freuen-auf-prep-everyday",
      "revision": 1,
      "entryId": "verb-freuen-auf",
      "type": "preposition_cloze",
      "prompt": "Ich freue mich ___ den Urlaub nächste Woche.",
      "exampleId": "verb-freuen-auf-everyday",
      "acceptedAnswers": [
        "auf"
      ],
      "explanation": "The future event is anticipated: sich freuen auf + Akkusativ."
    },
    {
      "id": "verb-freuen-auf-prep-technical",
      "revision": 1,
      "entryId": "verb-freuen-auf",
      "type": "preposition_cloze",
      "prompt": "Wir freuen uns ___ die Ergebnisse der neuen Testreihe.",
      "exampleId": "verb-freuen-auf-technical",
      "acceptedAnswers": [
        "auf"
      ],
      "explanation": "The future event is anticipated: sich freuen auf + Akkusativ."
    },
    {
      "id": "verb-freuen-auf-case",
      "revision": 1,
      "entryId": "verb-freuen-auf",
      "type": "case_choice",